Название объявления;Текст объявления;Марка Авто;Модель Авто;Год;Кузов;Цена;Фотография;Количество;Left-Right;Front-Back;Up-Down;Номер;Двигатель
Амортизатор задний газовы…;Амортизатор задний газовый Mitsubishi Pajero (STELLOX)  4203-9552-SX;Mitsubishi;Pajero;;;1138;;;;Back;;;
Амортизатор задний/газов.…;"Амортизатор задний/газов. FORD FOCUS II ""FORCETECH""";Ford;Focus;;;1430;;;;Back;;;
Амортизатор задний/газов.…;"Амортизатор задний/газов. FORD Focus II ""Pilenga""";Ford;Focus;;;1133;;;;Back;;;
Амортизатор задний/газов.…;"Амортизатор задний/газов. Renault Logan / Largus ""FINWHALE""";ВАЗ (Lada);Largus;;;1380;;;;Back;;;
Амортизатор задний/газов.…;"Амортизатор задний/газов. Renault Logan / Largus ""АТ""";ВАЗ (Lada);Largus;;;1180;;;;Back;;;
Амортизатор задний/газов.…;"Амортизатор задний/газов. Renault Logan / Largus ""СААЗ""";ВАЗ (Lada);Largus;;;1200;;;;Back;;;
Амортизатор задний/масл. …;"Амортизатор задний/масл. FIAT Ducato 3 ""FORCETECH""";Fiat;Ducato;;;1750;;;;Back;;;
Бачок расширительный Loga…;Бачок расширительный Logan 2005-2014;Renault;Logan;2014;;400;;;;;;;
Втулка стабилизатора Toyo…;"Втулка стабилизатора Toyota заднего ""AKITAKA""";Toyota;;;;98;;;;Back;;;
Гайка колеса HERZOG (12х1…;Гайка колеса HERZOG (12х1.5х34) /хром. закрытая/ 19мм;;;;;50;;;;;;;
;Гайка колеса ИНОМАРКА HERZOG (12х1.25х36) /хром. закрыт/ 19мм с 2 секр. ключами;;;;;310;;;;;;;
Гайка колеса  ИНОМАРКА се…;Гайка колеса  ИНОМАРКА секр. HERZOG (12х1.5х36) /хром. закрытая/ 19мм с 2 секр. ключами;;;;;315;;;;;;;
Гофра выхлопной системы 5…;Гофра выхлопной системы 55/230 (трехслойная);;;;;595;;;;;;;
Гофра выхлопной системы 5…;Гофра выхлопной системы 55/250 (трехслойная);;;;;640;;;;;;;
Гофра выхлопной системы 6…;Гофра выхлопной системы 60/100 (трехслойная);;;;;400;;;;;;;
Гофра выхлопной системы 7…;Гофра выхлопной системы 75/150 (трехслойная);;;;;630;;;;;;;
Гофра выхлопной системы 7…;Гофра выхлопной системы 75/250 (трехслойная);;;;;890;;;;;;;
Датчик давления абсолютно…;Датчик давления абсолютного Renault Logan;Renault;Logan;;;3790;;;;;;;
Диск тормозной Fiat Ducat…;"Диск тормозной Fiat Ducato 250/Peugeot Boxer III/Citroen Jumper III/ задний ""Pilenga""  ВМ 5388 (1ШТ)";Fiat;Ducato;;;2305;;;;Back;;;
Диск тормозной Fiat Ducat…;"Диск тормозной Fiat Ducato/Peugeot Boxer/Citroen Jumper/ R-16 ""ASP"" 24 мм толщ 1800кг. MAXI";Fiat;Ducato;;;1920;;;;;;;
Диск тормозной Fiat Ducat…;"Диск тормозной Fiat Ducato/Peugeot Boxer/Citroen Jumper/ R-16 ""ASP""  32 мм толщ";Fiat;Ducato;;;2640;;;;;;;
Диск тормозной Peugeot Pa…;"Диск тормозной Peugeot Partner/Citroen Berlingo/ передн. R-15 ""ASP""";Peugeot;Partner;;;820;;;;Front;;;
Коврик багажника Renault …;Коврик багажника Renault Logan II (с 2014г) ПОЛИУРЕТАН  Элерон;Renault;Logan;2014;;1168;;;;;;;
Коврики салона Fiat Ducat…;Коврики салона Fiat Ducato III (250) ПОЛИУРЕТАН (с 2006-13г) (передние);Fiat;Ducato;2006;;1143;;;;Front;;;
Коврики салона Hyundai So…;Коврики салона Hyundai Solaris резиновые г.Чайковск;Hyundai;Solaris;;;820;;;;;;;
Коврики салона Renault Lo…;Коврики салона Renault Logan I ПОЛИУРЕТАН (с 2006-14г) (3D с подпятником);Renault;Logan;2006;;1303;;;;;;;
Коврики салона Renault Lo…;Коврики салона Renault Logan II ПОЛИУРЕТАН (с 2014г) (3D с подпятником);Renault;Logan;2014;;1303;;;;;;;
Колодки тормозные задние …;Колодки тормозные задние  Ducato III МарКон (4шт/кт);Fiat;Ducato;;;550;;;;Back;;;
Колодки тормозные задние …;"Колодки тормозные задние FIAT Ducato II ""МарКон"" (4шт/кт)";Fiat;Ducato;;;530;;;;Back;;;
Колодки тормозные задние …;"Колодки тормозные задние Ford Focus II (4шт/кт) ""Маркон""";Ford;Focus;;;525;;;;Back;;;
Колодки тормозные задние …;"Колодки тормозные задние HYNDAI Solaris ""МарКон"" (4шт/кт)";Hyundai;Solaris;;;455;;;;Back;;;
Колодки тормозные передни…;Колодки тормозные передние Ducato МарКон R-15 (4шт/кт);Fiat;Ducato;;;760;;;;Front;;;
Колодки тормозные передни…;Колодки тормозные передние Ducato МарКон R-16 без датчика;Fiat;Ducato;;;700;;;;Front;;;
Колодки тормозные передни…;Колодки тормозные передние Ducato МарКон R-16 С ДАТЧИКОМ;Fiat;Ducato;;;975;;;;Front;;;
Колодки тормозные передни…;"Колодки тормозные передние Ford Focus II (4шт/кт) ""BOSCH""";Ford;Focus;;;1906;;;;Front;;;
Колодки тормозные передни…;"Колодки тормозные передние Ford Focus II (4шт/кт) ""Маркон""";Ford;Focus;;;696;;;;Front;;;
Колодки тормозные передни…;"Колодки тормозные передние KIA Carens/Sportage/ Hyndai IX-35  (4шт/кт) ""BOSCH""";Kia;Sportage;;;1930;;;;Front;;;
Колодки тормозные передни…;"Колодки тормозные передние Mitsubishi Lancer (4шт/кт) ""ПО Начало""";Mitsubishi;Lancer;;;416;;;;Front;;;
Колодки тормозные передни…;Колодки тормозные передние SKODA Fabia с 2003г. МарКон;Skoda;Fabia;2003;;750;;;;Front;;;
Колодки тормозные передни…;Колодки тормозные передние SKODA Octavia  МарКон;Skoda;Octavia;;;750;;;;Front;;;
Колодки тормозные передни…;Колодки тормозные передние TOYOTA Corona 1987-1992 МарКон;Toyota;Corona;1992;;395;;;;Front;;;
Колодки тормозные передни…;Колодки тормозные передние TOYOTA Corona/Sprinter 1992-2001 МарКон;Toyota;Sprinter;2001;;500;;;;Front;;;
Колодки тормозные передни…;"Колодки тормозные передние Wolkswagen Polo ""Маркон""";Volkswagen;Polo;;;650;;;;Front;;;
Колодки тормозные передни…;"Колодки тормозные передние Пежо Партнер типи ""Маркон""";Peugeot;Partner;;;755;;;;Front;;;
Лист рессоры Боксер/ПЕЖО …;Лист рессоры Боксер/ПЕЖО (1-листовая) R-16  задн. коренн.;Peugeot;;;;3050;;;;Back;;;
Наконечник рулевой FIAT D…;"Наконечник рулевой FIAT Ducato III наружн. (2шт/к-т) ""Pilenga""";Fiat;Ducato;;;1076;;;Left;;;;
Наконечник рулевой Toyota…;Наконечник рулевой Toyota RAV4 наружный левый CTR;Toyota;RAV4;;;570;;;Left;;;;
Наконечник рулевой Toyota…;Наконечник рулевой Toyota RAV4 наружный правый CTR;Toyota;RAV4;;;570;;;Left;;;;
Отбойник стойки Daewoo La…;Отбойник стойки Daewoo Lanos передней АТ;Daewoo;Lanos;;;243;;;;Front;;;
"Подогреватель двигателя ""…";"Подогреватель двигателя ""СЕВЕРС +"" С принуд. циркуляцией (2,0 кВт) УНИВЕРСАЛЬНЫЙ";;;;;4260;;;;;;;
"Подогреватель двигателя ""…";"Подогреватель двигателя ""СЕВЕРС +"" С принуд. циркуляцией (3,0 кВт) УНИВЕРСАЛЬНЫЙ";;;;;5440;;;;;;;
"Подогреватель двигателя ""…";"Подогреватель двигателя ""Спутник"" ДЛЯ ИНОМАРОК УНИВЕРСАЛЬНЫЙ (№2000) 1,5кВт пласт.тройник";;;2000;;1740;;;;;;;
"Подогреватель двигателя ""…";"Подогреватель двигателя ""СТАРТ"" 1,5кВт Mitsubushi 4G13/4G15";;;;;1885;;;;;;;
"Подогреватель двигателя ""…";"Подогреватель двигателя ""СТАРТ"" 1,5кВт NISSAN SUNNY/AD/AVENIR /QG13.15/";Nissan;Sunny;;;1895;;;;;;;
"Подогреватель двигателя ""…";"Подогреватель двигателя ""СТАРТ"" 1,5кВт NISSAN X-TRAIL";Nissan;X-Trail;;;1810;;;;;;;
"Подогреватель двигателя ""…";"Подогреватель двигателя ""СТАРТ"" 1,5кВт SUBARU LEGACY/FORESTER /EJ/";Subaru;Legacy;;;1790;;;;;;;
"Подогреватель двигателя ""…";"Подогреватель двигателя ""СТАРТ"" 1,5кВт TOYOTA COROLLA 1NZ-FE";Toyota;Corolla;;;1880;;;;;;;
"Подогреватель двигателя ""…";"Подогреватель двигателя ""СТАРТ"" 1,5кВт TOYOTA MARKII 1G-FE";Toyota;;;;1810;;;;;;;
"Подогреватель двигателя ""…";"Подогреватель двигателя ""Старт"" С ПОМПОЙ универсал №2 (1,5 кВт) с тройниками и штуцерами";;;;;3000;;;;;;;
"Подогреватель двигателя ""…";"Подогреватель двигателя ""Старт"" С ПОМПОЙ универсал №3 (3,0 кВт)";;;;;3520;;;;;;;
Подушка под пружину задня…;Подушка под пружину задняя Renault;Renault;;;;125;;;;Back;;;
Подшипник ступицы LADA La…;"Подшипник ступицы LADA Largus задний без АБС ""АТ""";ВАЗ (Lada);Largus;;;540;;;;Back;;;
Привод LOGAN RENAULT левы…;"Привод LOGAN RENAULT левый ""АТ"" (1,4/1,6)";Renault;Logan;;;2950;;;Left;;;;
Прокладка дросселя Лада Л…;Прокладка дросселя Лада Ларгус 16кл;ВАЗ (Lada);Largus;;;75;;;;;;;
Прокладка дросселя Лада Л…;Прокладка дросселя Лада Ларгус 8кл;ВАЗ (Lada);Largus;;;170;;;;;;;
Прокладка клапанной крышк…;"Прокладка клапанной крышки  Renaut, Nissan ""РТ""";Nissan;;;;245;;;;;;;
Прокладка коллектора впус…;Прокладка коллектора впускного Renault 16V;Renault;;;;156;;;;;;;
Прокладка коллектора впус…;"Прокладка коллектора впускного Renault 16V Лада Ларгус ""РТ""";ВАЗ (Lada);Largus;;;36;;;;;;;
Прокладка коллектора впус…;"Прокладка коллектора впускного Renault 8V Лада Ларгус ""РТ""";ВАЗ (Lada);Largus;;;120;;;;;;;
Прокладка поддона LADA La…;"Прокладка поддона LADA Largus Renault Logan ""РТ""";ВАЗ (Lada);Largus;;;220;;;;;;;
Регулятор холостого хода …;"Регулятор холостого хода RENAULT Logan ""АТ"" 1.4/1.6";Renault;Logan;;;280;;;;;;;
Ремень генератора  Logan …;"Ремень генератора  Logan 1820) 6РК Renault (16-кл.,1,6) (ГУР+конд) c 2010г ""DAYCO""";Renault;Logan;2010;;680;;;;;;;
Ремень генератора 7PK1905…;Ремень генератора 7PK1905;;;;;1424;;;;;;;
Рессора задняя Боксер/ПЕЖ…;Рессора задняя Боксер/ПЕЖО (2-листовая ) с сайлентблоками R-16;Peugeot;;;;8100;;;;Back;;;
Сайлентблок переднего рыч…;Сайлентблок переднего рычага CVKH-175 CTR;;;;;377;;;;Front;;;
Стекло лобовое SUZUKI GRA…;Стекло лобовое SUZUKI GRAND VITARA ll;Suzuki;Vitara;;;3240;;;;;;;
Стекло лобовое ТОYOTA Cor…;Стекло лобовое ТОYOTA Corolla /АЕ101/;Toyota;Corolla;;;2540;;;;;;;
Стекло переднее опускное …;Стекло переднее опускное RENAULT Logan/LADA Largus левое;ВАЗ (Lada);Largus;;;1550;;;Left;Front;;;
Стекло переднее опускное …;Стекло переднее опускное RENAULT Logan/LADA Largus правое;ВАЗ (Lada);Largus;;;1550;;;;Front;;;
Стойка передняя Renault L…;"Стойка передняя Renault Logan/Largus  ""FINWHALE"" газомаслян.";ВАЗ (Lada);Largus;;;2060;;;;Front;;;
Стойка передняя Renault L…;"Стойка передняя Renault Logan/Largus  ""KAYABA""/газов.";ВАЗ (Lada);Largus;;;3180;;;;Front;;;
Стойка передняя Renault L…;"Стойка передняя Renault Logan/Largus  ""АТ"" газомаслян.";ВАЗ (Lada);Largus;;;1450;;;;Front;;;
Стойка передняя TOYOTA /K…;Стойка передняя TOYOTA /KYB/;Toyota;;;;6990;;;;Front;;;
Стойка передняя/газов. FO…;"Стойка передняя/газов. FORD FOCUS II  правая ""Pilenga""";Ford;Focus;;;1833;;;Right;Front;;;
Стойка передняя/газов. FO…;"Стойка передняя/газов. FORD FOCUS II левая ""Pilenga""";Ford;Focus;;;1833;;;Left;Front;;;
Стойка стабилизатора FORD…;"Стойка стабилизатора FORD Focus II ""АТ""";Ford;Focus;;;300;;;;;;;
Стойка стабилизатора FORD…;"Стойка стабилизатора FORD Focus III ""АТ""";Ford;Focus;;;290;;;;;;;
Стойка стабилизатора HYUN…;"Стойка стабилизатора HYUNDAI Solaris ""АТ""";Hyundai;Solaris;;;274;;;;;;;
Стойка стабилизатора Rena…;"Стойка стабилизатора Renault Duster II ""АТ""";Renault;Duster;;;295;;;;;;;
Стойка стабилизатора Toyo…;"Стойка стабилизатора Toyota Corolla IХ ""АТ""";Toyota;Corolla;;;290;;;;;;;
Ступица LOGAN переднего к…;Ступица LOGAN переднего колеса  МР0075   21 зуб;Renault;Logan;;;987;;;;Front;;;
Тяга рулевая FIAT Ducato …;"Тяга рулевая FIAT Ducato III внутр. ""Pilenga""";Fiat;Ducato;;;590;;;Left;;;;
Тяга стабилизатора заднег…;Тяга стабилизатора заднего TOYOTA Avensis левая CTR;Toyota;Avensis;;;539;;;Left;Back;;;
Тяга стабилизатора заднег…;Тяга стабилизатора заднего TOYOTA Avensis правая CTR;Toyota;Avensis;;;539;;;Right;Back;;;
Тяга стабилизатора передн…;Тяга стабилизатора переднего TOYOTA Corolla CTR;Toyota;Corolla;;;682;;;;Front;;;
Уплотнитель двери передне…;Уплотнитель двери передней Логан/Ларгус в упаковке;ВАЗ (Lada);Largus;;;530;;;;Front;;;
"Фара ""Renault Logan 2"" ""A…";"Фара ""Renault Logan 2"" ""AL"" левая (с 2014г)";Renault;Logan;2014;;3180;;;Left;;;;
"Фара ""Renault Logan 2"" ""A…";"Фара ""Renault Logan 2"" ""AL"" правая (с 2014г)";Renault;Logan;2014;;3180;;;Right;;;;
"Фара ""Renault Logan"" ""AL""…";"Фара ""Renault Logan"" ""AL"" левая светлая";Renault;Logan;;;2300;;;Left;;;;
"Фара ""Renault Logan"" ""AL""…";"Фара ""Renault Logan"" ""AL"" правая светлая";Renault;Logan;;;2300;;;Right;;;;
"Фара ""Renault Logan"" ""AL""…";"Фара ""Renault Logan"" ""AL"" правая черная";Renault;Logan;;;2340;;;Right;;;;
Фара противотум.  Logan 2…;Фара противотум.  Logan 2005г,Focus 2009г /КИТАЙ/ белая универс.  (2шт);Renault;Logan;2009;;1170;;;;;;;
Фильтр воздушный  ПЕЖО Bo…;Фильтр воздушный  ПЕЖО Boxer,  Фиат Ducato III;Jaguar;XE;;;320;;;;;;;
Фильтр воздушный  ПЕЖО Bo…;Фильтр воздушный  ПЕЖО Boxer, Фиат Ducato III;Jaguar;XE;;;423;;;;;;;
Фильтр воздушный Asakashi…;Фильтр воздушный Asakashi;;;;;432;;;;;;;
Фильтр воздушный Asakashi…;Фильтр воздушный Asakashi;;;;;290;;;;;;;
Фильтр воздушный Asakashi…;Фильтр воздушный Asakashi;;;;;452;;;;;;;
Фильтр воздушный HYUNDAI …;Фильтр воздушный HYUNDAI  KIA CEED,ELANTRA, I-30;Kia;Elan;;;190;;;;;;;
Фильтр воздушный HYUNDAI …;Фильтр воздушный HYUNDAI Solaris, KIA Rio III, Sou;Kia;Rio;;;220;;;;;;;
Фильтр воздушный HYUNDAI …;Фильтр воздушный HYUNDAI Solaris, KIA Rio III, Sou;Kia;Rio;;;250;;;;;;;
Фильтр воздушный MITSUBIS…;Фильтр воздушный MITSUBISHI Lancer/Outlander;Mitsubishi;Outlander;;;255;;;;;;;
Фильтр воздушный NISSAN…;Фильтр воздушный NISSAN;Nissan;;;;126;;;;;;;
Фильтр воздушный NISSAN…;Фильтр воздушный NISSAN;Nissan;;;;94;;;;;;;
Фильтр воздушный NISSAN…;Фильтр воздушный NISSAN;Nissan;;;;174;;;;;;;
Фильтр воздушный NISSAN…;Фильтр воздушный NISSAN;Nissan;;;;140;;;;;;;
Фильтр воздушный RABBIT…;Фильтр воздушный RABBIT;Volkswagen;Rabbit;;;401;;;;;;;
Фильтр воздушный RABBIT /…;Фильтр воздушный RABBIT / MADFIL;Volkswagen;Rabbit;;;188;;;;;;;
Фильтр воздушный RABBIT /…;Фильтр воздушный RABBIT / MADFIL;Volkswagen;Rabbit;;;205;;;;;;;
Фильтр воздушный Sakura  …;Фильтр воздушный Sakura  A-1152;;;;;275;;;;;;;
Фильтр воздушный Sakura…;Фильтр воздушный Sakura;;;;;325;;;;;;;
Фильтр воздушный Sakura…;Фильтр воздушный Sakura;;;;;480;;;;;;;
Фильтр воздушный Sakura…;Фильтр воздушный Sakura;;;;;230;;;;;;;
Фильтр воздушный Sakura…;Фильтр воздушный Sakura;;;;;332;;;;;;;
Фильтр воздушный Sakura…;Фильтр воздушный Sakura;;;;;499;;;;;;;
Фильтр воздушный Sakura…;Фильтр воздушный Sakura;;;;;521;;;;;;;
Фильтр воздушный Sakura…;Фильтр воздушный Sakura;;;;;462;;;;;;;
Фильтр воздушный Sakura…;Фильтр воздушный Sakura;;;;;288;;;;;;;
Фильтр воздушный Sakura…;Фильтр воздушный Sakura;;;;;314;;;;;;;
Фильтр воздушный Sakura…;Фильтр воздушный Sakura;;;;;337;;;;;;;
Фильтр воздушный Sakura…;Фильтр воздушный Sakura;;;;;373;;;;;;;
Фильтр воздушный Sakura…;Фильтр воздушный Sakura;;;;;360;;;;;;;
Фильтр воздушный Sakura…;Фильтр воздушный Sakura;;;;;428;;;;;;;
Фильтр воздушный Sakura…;Фильтр воздушный Sakura;;;;;468;;;;;;;
Фильтр воздушный Sakura…;Фильтр воздушный Sakura;;;;;467;;;;;;;
Фильтр воздушный Sakura…;Фильтр воздушный Sakura;;;;;403;;;;;;;
Фильтр воздушный Sakura…;Фильтр воздушный Sakura;;;;;344;;;;;;;
Фильтр воздушный Sakura…;Фильтр воздушный Sakura;;;;;270;;;;;;;
Фильтр воздушный Sakura…;Фильтр воздушный Sakura;;;;;206;;;;;;;
Фильтр воздушный Sakura…;Фильтр воздушный Sakura;;;;;270;;;;;;;
Фильтр воздушный Sakura…;Фильтр воздушный Sakura;;;;;499;;;;;;;
Фильтр воздушный Sakura…;Фильтр воздушный Sakura;;;;;365;;;;;;;
Фильтр воздушный Sakura…;Фильтр воздушный Sakura;;;;;424;;;;;;;
Фильтр воздушный Sakura…;Фильтр воздушный Sakura;;;;;222;;;;;;;
Фильтр воздушный Sakura…;Фильтр воздушный Sakura;;;;;311;;;;;;;
Фильтр воздушный Sakura…;Фильтр воздушный Sakura;;;;;316;;;;;;;
Фильтр воздушный Sakura…;Фильтр воздушный Sakura;;;;;260;;;;;;;
Фильтр воздушный Sakura…;Фильтр воздушный Sakura;;;;;257;;;;;;;
Фильтр воздушный Sakura…;Фильтр воздушный Sakura;;;;;326;;;;;;;
Фильтр воздушный Sakura…;Фильтр воздушный Sakura;;;;;254;;;;;;;
Фильтр воздушный Sakura…;Фильтр воздушный Sakura;;;;;230;;;;;;;
Фильтр воздушный Sakura…;Фильтр воздушный Sakura;;;;;273;;;;;;;
Фильтр воздушный Sakura…;Фильтр воздушный Sakura;;;;;325;;;;;;;
Фильтр воздушный SUZUKI G…;Фильтр воздушный SUZUKI Grand Vitara (V-2,4) с 10,2008г;Peugeot;2008;2008;;246;;;;;;;
Фильтр воздушный SUZUKI G…;Фильтр воздушный SUZUKI Grand Vitara (V1,6/2,0) с 10,2005г;Suzuki;Vitara;2005;;215;;;;;;;
Фильтр воздушный SUZUKI S…;Фильтр воздушный SUZUKI SX-4;Suzuki;;;;150;;;;;;;
Фильтр воздушный TOYOTA (…;Фильтр воздушный TOYOTA (Camry дв.2AZFE) /06-11гг/;Toyota;Camry;;;260;;;;;;;
Фильтр воздушный TOYOTA (…;Фильтр воздушный TOYOTA (Corolla.Avensis- дв.1ZR-FAE,4ZZ-FE);Toyota;Corolla;;;270;;;;;;;
Фильтр воздушный TOYOTA (…;Фильтр воздушный TOYOTA (RAV4);Toyota;RAV4;;;275;;;;;;;
Фильтр воздушный TOYOTA F…;Фильтр воздушный TOYOTA Filtron;Toyota;;;;260;;;;;;;
Фильтр воздушный TOYOTA I…;Фильтр воздушный TOYOTA ISIS (аналог А-1180/А-1003);Toyota;Isis;;;335;;;;;;;
Фильтр воздушный TOYOTA L…;"Фильтр воздушный TOYOTA LEXUS RX 03-08; TOYOTA Camry 01-05, Highlander I";Toyota;Highlander;;;233;;;;;;;
Фильтр воздушный VIC…;Фильтр воздушный VIC;;;;;520;;;;;;;
Фильтр воздушный VIC  ACC…;Фильтр воздушный VIC  ACCORD.  TORNEO;Honda;Torneo;;;537;;;;;;;
Фильтр воздушный VIC  ACC…;Фильтр воздушный VIC  ACCORD. (аналог А-1655);Honda;Accord;;;633;;;;;;;
Фильтр воздушный VIC  AVA…;Фильтр воздушный VIC  AVANCIER  (аналог А-864J);Honda;Avancier;;;560;;;;;;;
Фильтр воздушный VIC  AVA…;Фильтр воздушный VIC  AVANCIER (аналог А-1634);Honda;Avancier;;;608;;;;;;;
Фильтр воздушный VIC CALD…;Фильтр воздушный VIC CALDINA. EXIV;Toyota;Caldina;;;425;;;;;;;
Фильтр воздушный VIC  COL…;Фильтр воздушный VIC  COLT;Mitsubishi;Colt;;;403;;;;;;;
Фильтр воздушный VIC  COR…;Фильтр воздушный VIC  COROLLA;Toyota;Corolla;;;400;;;;;;;
Фильтр воздушный VIC CORO…;Фильтр воздушный VIC COROLLA. CALDINA. CORONA;Toyota;Corona;;;490;;;;;;;
Фильтр воздушный VIC  CRO…;Фильтр воздушный VIC  CROWN;Toyota;Crown;;;625;;;;;;;
Фильтр воздушный VIC  DEM…;Фильтр воздушный VIC  DEMIO  (аналог А-1762);Mazda;Demio;;;499;;;;;;;
Фильтр воздушный VIC  EST…;Фильтр воздушный VIC  ESTIMA;Toyota;Estima;;;430;;;;;;;
Фильтр воздушный VIC  GAL…;Фильтр воздушный VIC  GALANT.  OUTLANDER  (аналог А-5828);Mitsubishi;Outlander;;;745;;;;;;;
Фильтр воздушный VIC  HIA…;Фильтр воздушный VIC  HIACE;Toyota;Hiace;;;470;;;;;;;
Фильтр воздушный VIC  HIA…;Фильтр воздушный VIC  HIACE;Toyota;Hiace;;;406;;;;;;;
Фильтр воздушный VIC  IMP…;Фильтр воздушный VIC  IMPREZA;Subaru;Impreza;;;620;;;;;;;
Фильтр воздушный VIC  LAN…;Фильтр воздушный VIC  LAND CRUISER;Toyota;Land Cruiser;;;380;;;;;;;
Фильтр воздушный VIC  LAN…;Фильтр воздушный VIC  LAND CRUISER;Toyota;Land Cruiser;;;590;;;;;;;
Фильтр воздушный VIC  LIT…;Фильтр воздушный VIC  LITEACE;AC;ACE;;;555;;;;;;;
